{
  "context_id": "ctx_foundation_example_1",
  "interaction_id": "int_foundation_ctx_1",
  "participants": [
    {
      "actor_id": "https://agents.example.com/actors/planner"
    },
    {
      "actor_id": "https://tools.example.com/actors/repo-reader"
    }
  ],
  "messages": [
    {
      "message_id": "msg_ctx_1",
      "interaction_id": "int_foundation_ctx_1",
      "role": "actor",
      "actor_ref": {
        "actor_id": "https://agents.example.com/actors/planner"
      },
      "content": {
        "text": "Please read config.yaml and summarize the database section."
      },
      "content_type": "application/json",
      "evidence_ref": "evt_ctx_1",
      "created_at": "2026-04-11T09:00:00Z"
    },
    {
      "message_id": "msg_ctx_2",
      "interaction_id": "int_foundation_ctx_1",
      "role": "peer",
      "actor_ref": {
        "actor_id": "https://tools.example.com/actors/repo-reader"
      },
      "content": {
        "text": "The database section specifies PostgreSQL 15 with connection pooling enabled."
      },
      "content_type": "application/json",
      "evidence_ref": "evt_ctx_2",
      "created_at": "2026-04-11T09:00:05Z"
    },
    {
      "message_id": "msg_ctx_3",
      "interaction_id": "int_foundation_ctx_1",
      "role": "actor",
      "actor_ref": {
        "actor_id": "https://agents.example.com/actors/planner"
      },
      "content": {
        "text": "Thank you. Marking interaction as complete."
      },
      "content_type": "application/json",
      "evidence_ref": "evt_ctx_3",
      "created_at": "2026-04-11T09:00:10Z"
    }
  ],
  "transitions": [
    {
      "transition_id": "tr_ctx_1",
      "interaction_id": "int_foundation_ctx_1",
      "from_state": "intent_received",
      "to_state": "executing",
      "triggered_by": {
        "actor_id": "https://agents.example.com/actors/planner"
      },
      "timestamp": "2026-04-11T09:00:00Z"
    },
    {
      "transition_id": "tr_ctx_2",
      "interaction_id": "int_foundation_ctx_1",
      "from_state": "executing",
      "to_state": "completed",
      "triggered_by": {
        "actor_id": "https://agents.example.com/actors/planner"
      },
      "timestamp": "2026-04-11T09:00:10Z"
    }
  ],
  "evidence_chain": [
    {
      "event_id": "evt_ctx_1",
      "interaction_id": "int_foundation_ctx_1",
      "event_type": "context.message_appended",
      "actor": "https://agents.example.com/actors/planner",
      "timestamp": "2026-04-11T09:00:00Z",
      "prev_event_hash": "sha256:0",
      "event_hash": "sha256:a1b2c3d4e5f6"
    },
    {
      "event_id": "evt_ctx_2",
      "interaction_id": "int_foundation_ctx_1",
      "event_type": "context.message_appended",
      "actor": "https://tools.example.com/actors/repo-reader",
      "timestamp": "2026-04-11T09:00:05Z",
      "prev_event_hash": "sha256:a1b2c3d4e5f6",
      "event_hash": "sha256:b2c3d4e5f6a7"
    },
    {
      "event_id": "evt_ctx_3",
      "interaction_id": "int_foundation_ctx_1",
      "event_type": "context.message_appended",
      "actor": "https://agents.example.com/actors/planner",
      "timestamp": "2026-04-11T09:00:10Z",
      "prev_event_hash": "sha256:b2c3d4e5f6a7",
      "event_hash": "sha256:c3d4e5f6a7b8"
    }
  ],
  "delegations": [],
  "current_state": "completed",
  "created_at": "2026-04-11T09:00:00Z",
  "updated_at": "2026-04-11T09:00:10Z"
}
